2210,統一生活事業-台北市第八十二分公司,臺北市中正區黎明里忠孝西路１段５０之１號地下街,121.515823,25.046304
2211,統一生活事業-台北市第八十五分公司,臺北市北投區榮華里明德路８８號,121.519577,25.109376
2212,統一生活事業-台北市第八十四分公司,臺北市北投區尊賢里尊賢街２０８號,121.508077,25.11541
2213,統一生活事業-台北市第十一分公司,臺北市信義區吳興街２６５號１樓,121.563903,25.026945
2214,統一生活事業-台北市第三十七分公司,臺北市萬華區富民里西園路１段１５３號地下樓,121.49946,25.035853
2215,統一生活事業-台北市第三十二分公司,臺北市大同區承德路１段２９號１樓,121.517296,25.050919
2216,統一生活事業-台北市第三十八分公司,臺北市大安區福住里永康街７之２號１樓,121.52991,25.033036
2217,統一生活事業-台北市第三十三分公司,臺北市中正區文祥里信義路２段１號１，２樓,121.524535,25.035585
2218,統一生活事業-台北市第三十分公司,臺北市中山區江寧里復興北路３５４號,121.543975,25.06026
2219,統一生活事業-台北市第五十九分公司,臺北市大安區群賢里復興南路２段２７９號１樓,121.543646,25.025451
2220,統一生活事業-台北市第五十二分公司,臺北市中山區正義里林森北路１１１號１樓,121.525075,25.050517
2221,統一生活事業-台北市第五十三分公司,臺北市松山區東榮里民生東路５段１１９之１號,121.560805,25.058888
2222,統一生活事業-台北市第五十分公司,臺北市南港區新光里忠孝東路６段４４６號,121.593897,25.050242
2223,統一生活事業-台北市第六十一分公司,臺北市中正區寧波西街１１號,121.518575,25.031414
2224,統一生活事業-台北市第六十七分公司,臺北市松山區八德路３段７４巷１０號１樓,121.552478,25.047745
2225,統一生活事業-台北市第六十九分公司,臺北市北投區開明里中和街３００號１樓,121.500124,25.140727
2226,統一生活事業-台北市第六十四分公司,臺北市文山區興得里興隆路３段８８號,121.556806,24.999621
2227,統一生活事業-台北市第四十九分公司,臺北市大安區黎孝里安居街５號１樓,121.555301,25.021207
2228,統一生活事業-台北市第四十二分公司,臺北市中山區松江路３０７號１樓,121.533405,25.061467
2229,統一生活事業-台北市第四十八分公司,臺北市松山區中正里八德路２段４３５號１至４樓,121.546765,25.048313
2230,統一生活事業-台北市第四十三分公司,臺北市中山區中山里林森北路２８２號１樓,121.525354,25.055549
2231,統一生活事業-台北市第四十六分公司,臺北市中山區恆安里農安街１４號１樓,121.524411,25.064853
2232,統一生活事業-台北第１０８分公司,臺北市文山區忠順里興隆路４段１５５號,121.561782,24.984613
2233,統一生活事業-台北第１２４分公司,臺北市南港區萬福里忠孝東路６段８號,121.583307,25.045295
2234,統一生活事業-台北第七十六分公司,臺北市文山區景華里景中街３號,121.541567,24.993043
2235,統一生活事業-台北第七分公司,臺北市中山區林森北路４１１號１樓,121.525685,25.059698
2236,統一生活事業-台北第五十一分公司,臺北市大安區羅斯福路３段２９７之４號１樓,121.531738,25.017567
2237,統一生活事業-松捷門市部,臺北市信義區永吉里松山路１１號（Ｂ１樓）Ｂ３、Ｂ４櫃位,121.578252,25.048456
2238,統一生活事業-第五十五公司,臺北市士林區福林里中正路２３５巷２號１樓,121.525998,25.094955
2239,統一生活事業-頂東門市部,臺北市大安區光武里大安路１段４３號,121.546294,25.043477
2240,統一生活事業-臺北市第１４９分公司,臺北市中山區成功里敬業三路１１號,121.55591,25.083572
2241,統一星巴克（股）台北市第六十二分公司,臺北市士林區福林里中正路２３９號,121.525871,25.095151
2242,統一星巴克-１０１門市部,臺北市信義區西村里市府路４５號１樓,121.563904,25.034026
2243,統一星巴克-仁愛延吉門市部,臺北市大安區正聲里延吉街１７５號１樓,121.555457,25.038277
2244,統一星巴克-台北市九分公司,臺北市大安區和平東路１段２號˙４號１樓,121.522907,25.026824
2245,統一星巴克-台北市六十八分公司,臺北市松山區復勢里八德路３段２５１號,121.557651,25.048345
2246,統一星巴克-台北市第９６分公司,臺北市文山區樟樹里木新路三段１６２號１、２樓,121.561067,24.981887
2247,統一星巴克-台北市第一分公司,臺北市士林區天玉里天母西路３３號１樓,121.527735,25.118503
2248,統一星巴克-台北市第七十七分公司,臺北市大安區全安里敦化南路２段２６３號１樓,121.549121,25.025517
2249,統一星巴克-台北市第七十九分公司,臺北市內湖區西湖里基湖路２５號,121.565107,25.080642
2250,統一星巴克-台北市第七十二分公司,臺北市大安區光武里復興南路１段１３５巷９號,121.544825,25.042724
2251,統一星巴克-台北市第七十八分公司,臺北市內湖區寶湖里民權東路６段１８２號,121.592918,25.068613
2252,統一星巴克-台北市第七十三分公司,臺北市內湖區西湖里內湖路１段２８９號１樓,121.567133,25.082317
2253,統一星巴克-台北市第七十五分公司,臺北市中正區黎明里館前路２６號,121.514907,25.044879
2254,統一星巴克-台北市第七十六分公司,臺北市大安區古莊里師大路７４號１樓,121.528192,25.023597
2255,統一星巴克-台北市第七十四分公司,臺北市士林區天山里天母東路６７之１號,121.534399,25.118237
2256,統一星巴克-台北市第九十一分公司,臺北市信義區景勤里吳興街２２０巷１號,121.562904,25.027668
2257,統一星巴克-台北市第九十二分公司,臺北市信義區安康里信義路６段１、３號,121.574771,25.033914
2258,統一星巴克-台北市第九十三分公司,臺北市大同區延平里重慶北路２段１７２號及保安街１１、１３號,121.513441,25.059585
2259,統一星巴克-台北市第九十五分公司,臺北市松山區東光里南京東路五段１７１號１樓,121.563521,25.051623
2260,統一星巴克-台北市第九十分公司,臺北市萬華區新忠里西藏路１２３號１樓及１２５巷２號１樓,121.502506,25.029501
2261,統一星巴克-台北市第九十四分公司,臺北市庫倫街５１號、５１之１號及承德路３段２６３號２樓之１,121.51925,25.072045
2262,統一星巴克-台北市第二十七分公司,臺北市中山區江寧里民權東路３段８８號,121.543708,25.06211
2263,統一星巴克-台北市第二十五分公司,臺北市大安區龍門里和平東路２段４２之１號,121.537303,25.025446
2264,統一星巴克-台北市第二十四分公司,臺北市松山區民生東路３段１０５號１﹒２樓,121.544747,25.057981
2265,統一星巴克-台北市第八十一分公司,臺北市中正區南陽街１號２樓,121.5162283,25.04581248
2266,統一星巴克-台北市第八十七分公司,臺北市大安區通化里文昌街２０９號１樓,121.554509,25.032456
2267,統一星巴克-台北市第八十九分公司,臺北市北投區榮華里振興街３７號,121.522429,25.117707
2268,統一星巴克-台北市第八十二分公司,臺北市內湖區湖元里新湖二路１２８號,121.578846,25.062491
2269,統一星巴克-台北市第八十八分公司,臺北市中正區梅花里忠孝東路１段３１號１樓,121.525336,25.044536
2270,統一星巴克-台北市第八十三分公司,臺北市內湖區清白里成功路４段１４７號１，２樓,121.593819,25.082996
2271,統一星巴克-台北市第八十五分公司,臺北市南港區三重里南港路１段１１４號,121.613758,25.055445
2272,統一星巴克-台北市第八十分公司,臺北市文山區木柵里木柵路３段７５號,121.566909,24.988721
2273,統一星巴克-台北市第八十六分公司,臺北市中山區成功里敬業二路１１５號１樓,121.554222,25.083221
2274,統一星巴克-台北市第八十四分公司,臺北市士林區承德里承德路４段６７號,121.52322,25.081705
2275,統一星巴克-台北市第十八分公司,臺北市松山區美仁里南京東路４段５６號１樓,121.553847,25.051437
2276,統一星巴克-台北市第十五分公司,臺北市大安區仁愛里忠孝東路４段１３４號１樓,121.548356,25.041333
2277,統一星巴克-台北市第十分公司,臺北市松山區民生東路５段１５８號１樓,121.562877,25.058596
2278,統一星巴克-台北市第十六分公司,臺北市大安區復興南路１段３２３號１，２，３樓,121.5438076,25.03376137
2279,統一星巴克-台北市第十四分公司,臺北市松山區民生東路３段１５６之１號,121.547681,25.05717
2280,統一星巴克-台北市第三十一分公司,臺北市萬華區萬壽里漢中街５１號１至３樓,121.507481,25.044114
2281,統一星巴克-台北市第三十九分公司,臺北市內湖區西康里內湖路１段３６０巷２之１號,121.565416,25.082631
2282,統一星巴克-台北市第三十二分公司,臺北市大安區龍淵里辛亥路２段１７３號,121.5412102,25.02169009
2283,統一星巴克-台北市第三十八分公司,臺北市中正區懷寧街１０號２樓,121.514125,25.046142
2284,統一星巴克-台北市第三十五分公司,臺北市大安區義安里敦化南路２段１０１號,121.549183,25.028754
2285,統一星巴克-台北市第三十分公司,臺北市中山區松江路２１０號１樓,121.532909,25.057748
2286,統一星巴克-台北市第三十六分公司,臺北市中正區羅斯福路４段２６號２樓,121.53328,25.015458
2287,統一星巴克-台北市第三分公司,臺北市松山區敦化北路１４７號１樓,121.54936,25.053908
2288,統一星巴克-台北市第五十九分公司,臺北市信義區新仁里東興路６５號１樓,121.5666,25.04701
2289,統一星巴克-台北市第五十八分公司,臺北市內湖區港墘里瑞光路４７６號,121.569554,25.078522
2290,統一星巴克-台北市第五十五分公司,臺北市文山區政大里指南路２段１０５號１樓,121.575707,24.987833
2291,統一星巴克-台北市第五十六分公司,臺北市大安區義安里敦化南路２段５９號,121.549194,25.031196
2292,統一星巴克-台北市第六十一分公司,臺北市信義區富台里忠孝東路５段２９７號,121.572849,25.041147
2293,統一星巴克-台北市第六十七分公司,臺北市中正區文祥里信義路２段１之１號,121.524658,25.035516
2294,統一星巴克-台北市第六十九分公司,臺北市中正區龍福里南海路２０號,121.517011,25.032493
2295,統一星巴克-台北市第六十三分公司,臺北市北投區長安里光明路２１８之４號１樓,121.504368,25.136238
2296,統一星巴克-台北市第六十五分公司,臺北市大安區復興南路２段２７５號,121.543648,25.025578
2297,統一星巴克-台北市第六十分公司,臺北市中山區江寧里民權東路３段２２號,121.540528,25.062136
2298,統一星巴克-台北市第六十六分公司,臺北市北投區振華里石牌路２段７４號,121.516203,25.116513
2299,統一星巴克-台北市第六十四分公司,臺北市中正區幸市里忠孝東路２段１３４巷２號,121.531706,25.041964
2300,統一星巴克-台北市第六分公司,臺北市大安區大學里羅斯福路３段３０１號１樓,121.531859,25.017447
2301,統一星巴克-台北市第四十一分公司,臺北市內湖區南湖里康寧路３段７２號地下一層,121.611274,25.07021
2302,統一星巴克-台北市第四十三分公司,臺北市松山區八德路３段１０之１號１樓,121.550161,25.047948
2303,統一星巴克-台北市第四十分公司,臺北市南港區三重里三重路１９之１０號,121.613519,25.058139
2304,統一星巴克-台北市第四十六分公司,臺北市中山區集英里民生西路７號,121.521717,25.057918
2305,統一星巴克-台北市第四分公司,臺北市士林區文林路１２２號１樓,121.526451,25.088341
2306,統一星巴克-台北第十二分公司,臺北市中山區恆安里中山北路２段１７１號１﹒２樓,121.522843,25.062978
2307,統一星巴克-台北第三十三分公司,臺北市大同區光能里南京西路２７號１樓,121.520189,25.052839
2308,統一星巴克-台北圓環門市部,臺北市大同區建功里南京西路２８８號１樓，２樓之５，２樓之６,121.513989,25.05391
2309,統一星巴克-同領門市部,臺北市大安區建安里忠孝東路４段２０１號,121.551774,25.041678
2310,統一星巴克-西門成都門市部,臺北市萬華區西門里成都路８７號１之３樓,121.504648,25.042978
2311,統一星巴克-松仁門市部,臺北市信義區安康里松仁路９號１樓,121.568865,25.038162
2312,統一星巴克-松安門市部,臺北市中山區朱園里松江路６１之１號１樓,121.533174,25.048651
2313,統一星巴克-南山門市部,臺北市信義區景新里莊敬路１６８號,121.561095,25.031771
2314,統一星巴克-南京建國門市,臺北市中山區復華里南京東路三段１號１、２樓,121.537187,25.052216
2315,統一星巴克-南京林森門市部,臺北市中山區正得里南京東路１段５２號１樓,121.524669,25.05195
2316,統一星巴克-南園門市部,臺北市南港區三重里園區街３號２樓之７,121.611987,25.058478
2317,統一星巴克-洲子門市部,臺北市內湖區港墘里洲子街４８號,121.573307,25.079042
2318,統一星巴克-重慶門市部,臺北市中正區光復里重慶南路１段１０４號１之３樓,121.513086,25.042432
2319,統一星巴克-華視門市部,臺北市大安區華聲里光復南路１８０巷１４號,121.556897,25.042531
2320,統一星巴克-華碩門市部,臺北市北投區一德里立德路１５號３樓,121.471438,25.124942
2321,統一星巴克-壹零壹三十五門市部,臺北市信義區西村里信義路５段７號３５樓,121.56479,25.033417
2322,統一星巴克-港墘門市部,臺北市內湖區瑞光路２１６號,121.576162,25.075358
2323,統一星巴克-臺北市第四十九分公司,臺北市北投區湖山里湖山路１段１４之１號,121.547359,25.152501
2324,統一星巴克-舊宗門市部,臺北市內湖區湖元里舊宗路１段１８８號,121.575989,25.062653
2325,統一星巴-台北第七分公司,臺北市士林區士東路１２３號１樓,121.530677,25.112438
2326,統一速達-１０４９營業所,臺北市中正區重慶南路一段１０號１０樓１００８室,121.513136,25.046588
2327,統一速達-士林營業所,臺北市北投區建民里承德路六段３３５之２號,121.511607,25.10407
2328,統一速達-大同營業所,臺北市中山區大佳里濱江街９９號,121.53496,25.073303
2329,統一速達-大安營業所,臺北市大安區黎和里和平東路３段４０６巷２１號,121.557536,25.018606
2330,統一速達-中山營業所,臺北市中山區濱江街２８４號,121.544751,25.07193
2331,統一速達-中正營業所,臺北市中正區龍興里三元街１５４號１樓,121.510764,25.028037
2332,統一速達-內湖營業所,臺北市內湖區湖元里民權東路６段２１巷６９號,121.579787,25.069632
2333,統一速達-北大安營業所,臺北市大安區敦安里安和路１段１１２巷１９號,121.550698,25.033995
2334,統一速達-北投營業所,臺北市北投區一德里立功街１２０號,121.47317,25.125111
2335,統一速達-松山營業所,臺北市松山區新東里塔悠路３２１號,121.568893,25.061378
2336,統一速達-信義營業所,臺北市信義區四維里忠孝東路五段４２３巷７４號１樓,121.575498,25.043694
2337,統一速達-南中山營業所,臺北市中山區大佳里濱江街９９號１樓,121.53496,25.073303
2338,統一速達-南信義營業所,臺北市信義區嘉興里嘉興街１２７巷２號１樓,121.557641,25.028925
2339,統一速達-南港營業所,臺北市重陽里重陽路２３７號,121.602573,25.057851
2340,統一速達-第１０５２營業所,臺北市松山區精忠里敦化北路３４０之９號機場內,121.551905,25.063649
2341,統一速達-第１０５３營業所,臺北市萬華區雙園里西藏路４３０號,121.497225,25.029409
2342,統一速達-第１０５４營業所,臺北市松山區東昌里民生東路４段１１２巷２８號１樓,121.554395,25.056356
2343,統一速達-第１０５９營業所,臺北市北投區建民里承德路六段３３５之２號,121.511607,25.10407
2344,統一超市-台北市第６５分公司,臺北市士林區中正路２２０２２２號１樓,121.526079,25.09552
2345,統一超商-台北市第五０九分公司,臺北市內湖區紫陽里陽光街１５９號１樓,121.585314,25.074942
2346,統一超商-台北市第五０八分公司,臺北市內湖區湖元里陽光街３８３號,121.576353,25.072744
2347,統一超商-台北市第四八Ｏ分公司,臺北市中山區埤頭里八德路２段３１４號１樓,121.542836,25.04718
2348,統一超商-台北市第四四Ｏ分公司,臺北市中山區復華里遼寧街１０８巷１號及１１０號１樓,121.541918,25.052562
2349,統一超商-台北４２４分公司,臺北市內湖區康寧里康寧路３段９９巷１４號及康寧路３段９９巷１２弄２號,121.610764,25.072708
2350,統一超商-台北市第３６５分公司,臺北市信義區林口街４８號,121.579467,25.038259
2351,統一超商-台北市第七四七分公司,臺北市士林區忠誠里德行東路１０８號１樓,121.52865,25.10765
2352,統一超商-台北市第二七三分公司,臺北市內湖區葫洲里民權東路６段２９６巷３號１樓,121.605482,25.072345
2353,統一超商-台北第２９分公司,臺北市大安區永康街４３號１樓,121.529586,25.030409
2354,統一超商,臺北市松山區東興路８號８樓,121.564971,25.050121
2355,統一超商,臺北市大安區民炤里信義路３段３３號,121.534624,25.033765
2356,統一超商-台北市第七六三分公司,臺北市內湖區西安里環山路一段７０號,121.566989,25.08651
2357,統一超商-台北市第七六五分公司,臺北市士林區葫蘆里延平北路五段２７１號,121.509564,25.085318
2358,統一超商-台北市第七五五分公司,臺北市內湖區金湖里金湖路４０５號,121.604353,25.073335
2359,統一超商-台北市第２７８分公司,臺北市中山區中山北路１段１０５巷１３號１樓,121.523308,25.050795
2360,統一超商-大安門市部,臺北市大安區光武里大安路１段７７號地下街６之１號店舖,121.546307,25.042247
2361,統一超商-大潤發門市部,臺北市內湖區湖元里舊宗路１段１２８號,121.57832,25.060963
2362,統一超商-中華電門市部,臺北市中正區東門里信義路１段２１之３號Ｂ１樓,121.523003,25.036419
2363,統一超商-世新大門市部,臺北市文山區試院里木柵路１段１７巷１號,121.544099,24.988624
2364,統一超商-台北１９６分公司,臺北市文山區木新里指南路１段３４，３６號,121.569662,24.987574
2365,統一超商-台北市２６分公司,臺北市松山區中正里八德路２段４３９號,121.546956,25.04831
2366,統一超商-台北市３０７分公司,臺北市松山區南京東路４段５１之２號１樓,121.551058,25.051892
2367,統一超商-台北市４３０分公司,臺北市大安區武里忠孝東路４段１０１巷７號,121.54814,25.042103
2368,統一超商-台北市４８２分公司,臺北市大安區臨江里基隆路２段１４２之１﹒１４２之２號１樓,121.556475,25.028204
2369,統一超商-台北市一六五第分公司,臺北市北投區中庸里大業路７１５號,121.500863,25.137235
2370,統一超商-台北市七０四分公司,臺北市南港區三重里三重路２３號,121.61408,25.059284
2371,統一超商-台北市二二六分公司,臺北市萬華區福音里桂林路５５號１樓,121.503082,25.038279
2372,統一超商-台北市四七九分公司,臺北市大安區住安里復興南路２段１７號１樓,121.543788,25.032341
2373,統一超商-台北市四八五分公司,臺北市大安區義安里安和路２段７４巷１號,121.551634,25.030228
2374,統一超商-台北市第１０１分公司,臺北市中山區中吉里一江街２３號１樓,121.531651,25.05284
2375,統一超商-台北市第１０２分公司,臺北市南港區九如里研究院路２段１５２號１樓,121.61687,25.038366
2376,統一超商-台北市第１０６分公司,臺北市士林區天玉里天母西路３９之１號,121.527399,25.118627
2377,統一超商-台北市第１０８分公司,臺北市文山區明興里木柵路２段１５９號,121.562986,24.98913
2378,統一超商-台北市第１０９分公司,臺北市中山區龍江路２８１之１號１樓,121.540845,25.060145
2379,統一超商-台北市第１０分公司,臺北市南港區東新里興華路９０號,121.605659,25.056116
2380,統一超商-台北市第１１０分公司,臺北市大安區瑞安街１８２號１樓,121.541016,25.028552
2381,統一超商-台北市第１１３分公司,臺北市中正區寧波西街３號１樓,121.518705,25.031491
2382,統一超商-台北市第１１４分公司,臺北市中山區林森北路４１１號１樓,121.525685,25.059698
2383,統一超商-台北市第１１７分公司,臺北市士林區新安里仰德大道３段６８ˋ７０號,121.552874,25.118855
2384,統一超商-台北市第１１分公司,臺北市大安區住安里信義路４段７４號１樓,121.5468254,25.03313788
2385,統一超商-台北市第１２０分公司,臺北市中山區江山里復興北路３５２號,121.543932,25.060098
2386,統一超商-台北市第121分公司,臺北市松山區慈祐里塔悠路３１，３３號,121.571616,25.050692
2387,統一超商-台北市第１２２分公司,臺北市大安區和平東路２段１８號１樓,121.536005,25.025692
2388,統一超商-台北市第１２３分公司,臺北市士林區忠義街１２１號,121.532812,25.107674
2389,統一超商-台北市第１２５分公司,臺北市文山區羅斯福路６段２０，２２號１樓,121.53949,25.000029
2390,統一超商-台北市第１３１分公司,臺北市北投區中央北路４段５１３號１樓,121.468519,25.128138
2391,統一超商-台北市第１３２分公司,臺北市大安區光復南路２６２號１樓,121.557401,25.040184
2392,統一超商-台北市第１３４分公司,臺北市士林區至誠路２段３１號１樓,121.529354,25.10177
2393,統一超商-台北市第１３６分公司,臺北市中正區汀州路１段１２７，１２９號１樓,121.509527,25.028045
2394,統一超商-台北市第１３７分公司,臺北市中山區吉林路３６５?３６７號１樓，農安街１３７號１樓,121.530484,25.064959
2395,統一超商-台北市第１３８分公司,臺北市文山區羅斯福路６段３０８?３１０號,121.539655,24.990526
2396,統一超商-台北市第１４１分公司,臺北市大同區朝陽里重慶北路２段６０號１樓,121.51382,25.05579
2397,統一超商-台北市第１４２分公司,臺北市大安區建安里敦化南路１段１８７巷２９號,121.550673,25.042667
2398,統一超商-台北市第１４３分公司,臺北市中山區龍江路３２２號３２２之１號３３２之２號,121.540829,25.064848
2399,統一超商-台北市第１４４分公司,臺北市士林區格致路５７號１樓,121.546263,25.13789
2400,統一超商-台北市第１４７分公司,臺北市中山區八德路２段２８２號１樓,121.541686,25.046892
2401,統一超商-台北市第１４８分公司,臺北市文山區萬興里指南路２段９９號,121.575537,24.987793
2402,統一超商-台北市第１５０分公司,臺北市中正區河堤里汀州路２段２１０號,121.523667,25.022405
2403,統一超商-台北市第１５１分公司,臺北市文山區順興里忠順街２段１０號１樓,121.562365,24.984513
2404,統一超商-台北市第１５３分公司,臺北市南港區南港路１段３０５?３０７號１樓,121.607696,25.054426
2405,統一超商-台北市第１５７分公司,臺北市大同區蓬萊里蘭州街１３５號１樓、昌吉街７２、７４、７６號１樓,121.515786,25.065723
2406,統一超商-台北市第１６０分公司,臺北市大安區建國南路２段１５１巷６，８號１樓,121.538267,25.028691
2407,統一超商-台北市第１６１分公司,臺北市南港區忠孝東路６段４４８號１樓,121.593985,25.050262
2408,統一超商-台北市第１６６分公司,臺北市文山區景興路１１３?１１５號,121.544817,24.994849
2409,統一超商-台北市第１６８分公司,臺北市北投區中和街４７６號,121.495171,25.145284
2410,統一超商-台北市第１７０分公司,臺北市士林區仁勇里大北路１４ˋ１６號,121.526591,25.089778
2411,統一超商-台北市第１７１分公司,臺北市士林區忠義街６８號１樓,121.531307,25.105882
2412,統一超商-台北市第１７２分公司,臺北市萬華區壽德里萬青街１６８號１樓,121.501469,25.023519
2413,統一超商-台北市第１７４分公司,臺北市南港區仁福里福德街３７３巷２５號１樓,121.59176,25.039352
2414,統一超商-台北市第１７６分公司,臺北市南港區新光里昆陽街１５０之１﹒１５０之３號１樓,121.59419,25.049187
2415,統一超商-台北市第１７８分公司,臺北市大安區全安里和平東路３段９７﹒９７之１號１樓,121.550779,25.024613
2416,統一超商-台北市第１８１分公司,臺北市萬華區漢中街５１號１樓,121.507481,25.044114
