3026,統一超商-信運門市部,臺北市信義區三張里松勤街１００號,121.566756,25.031805
3027,統一超商-泉源門市部,臺北市北投區中心里泉源路３０號地下,121.50668,25.139956
3028,統一超商-國青門市部,臺北市大安區學府里辛亥路３段３０號,121.544248,25.020572
3029,統一超商-國圖門市部,臺北市中正區建國里中山南路２０號,121.516715,25.037325
3030,統一超商-第１１９分公司,臺北市大同區蓬萊里承德路３段６０﹒６０之１號１樓,121.518108,25.065323
3031,統一超商-第１２６分公司,臺北市北投區清江里崇仁路１段７６號１樓,121.501473,25.126223
3032,統一超商-第１２９分公司,臺北市大安區延吉街２３７號,121.555692,25.036604
3033,統一超商-第１８５分公司,臺北市北投區自強街８２號１樓,121.514609,25.110551
3034,統一超商-第２３６分公司,臺北市大同區保安里重慶北路３段３０９?３１１號１樓,121.514051,25.073903
3035,統一超商-第２３９分公司,臺北市內湖區週美里新明路３１７號,121.58465,25.056875
3036,統一超商-第２４６分公司,臺北市士林區東山里德行東路３３１巷３５號１樓,121.537859,25.11175
3037,統一超商-第３００分公司,臺北市內湖區康寧路３段２６巷１號１樓,121.60798,25.072151
3038,統一超商-第３８９分公司,臺北市大同區南芳里延平北路２段１５９號１６１號１樓,121.5115962,25.05826274
3039,統一超商-第４１５分公司,臺北市大安區敦煌里仁愛路４段２６６巷１５弄２２號,121.554219,25.036537
3040,統一超商-第５１６分公司,臺北市大同區老師里延平北路４段１５７﹒１５９號１樓,121.511394,25.073104
3041,統一超商-第581分公司,臺北市大同區鄰江里延平北路４段１６號１８號１樓,121.510776,25.069097
3042,統一超商-第二七０分公司,臺北市大同區寧夏路１３１之１號１樓，涼州街４之２號１樓,121.51449,25.06068
3043,統一超商-第三五三分公司,臺北市中山區中央里長春路１６８號,121.533339,25.054667
3044,統一超商-第五０一分公司,臺北市大安區忠孝東路３段２４９之１號１樓,121.541549,25.041846
3045,統一超商-第五三九分公司,臺北市文山區興業里興隆路２段２４４巷２０號,121.553188,25.000117
3046,統一超商-第六八０分公司,臺北市大同區星明里民生西路２１４，２１６號１樓,121.514943,25.056901
3047,統一超商-第四三四分公司,臺北市文山區政大里指南路２段１４９號,121.577301,24.987445
3048,統一超商-第四四二分公司,臺北市大同區大有里民生西路３４３號,121.511172,25.05703
3049,統一超商-萬芳醫門市部,臺北市文山區興光里興隆路３段１１１號,121.55833,25.000306
3050,統一超商-實踐新天地門市部,臺北市中山區大直里大直街７０號,121.546234,25.083587
3051,統一超商-臺北市第３１９分公司,臺北市萬華區西寧南路８５號１樓,121.506845,25.045544
3052,統一超商-臺北市第６４１分公司,臺北市萬華區華中里萬大路４６４號,121.497598,25.020141
3053,統一超商-臺北市第６７０分公司,臺北市士林區永倫里延平北路６段２０２﹒２０４號１樓,121.505164,25.08958
3054,統一超商-臺北市第六六一分公司,臺北市大同區建明里太原路４２號１樓,121.515111,25.050412
3055,統一超商-臺北第５分公司,臺北市士林區文昌路６４號１樓,121.521373,25.096124
3056,統一超商-劍潭站門市部,臺北市士林區福林里中山北路５段６５號,121.5251798,25.08532032
3057,統一超商-德天門市部,臺北市士林區德行里德行西路５２號１樓,121.523427,25.104647
3058,統一超商-興舍門市部,臺北市大安區學府里長興街５０號,121.545008,25.016501
3059,統一超商-鑫華福門市部,臺北市中正區懷寧街３０﹒３２號１樓,121.514101,25.045417
3060,統一超商-第２８９分公司,臺北市文山區木柵里木柵路３段８８號,121.566978,24.988536
3061,統一超商-第３０６分公司,臺北市北投區承德路７段３７８號１樓,121.502832,25.118725
3062,萬事威,臺北市大安區新龍里建國南路２段７９巷１２號１Ｆ,121.538632,25.030711
3063,萬象有線電視,臺北市文山區興隆路４段１０９巷９６號,121.563687,24.98677
3064,葡其實業-桂林門市,臺北市萬華區仁德里桂林路１號,121.506304,25.037675
3065,葳町釦,臺北市中山區民安里南京西路２號１樓,121.522205,25.052144
3066,補時商行,臺北市大安區龍淵里和平東路２段９６巷１５弄３０號１樓,121.542367,25.023325
3067,買對,臺北市大安區和安里復興南路１段３９０號４樓之３,121.543382,25.033723
3068,費利蒙,臺北市大安區華聲里光復南路１８０巷１１號１樓,121.556832,25.042131
3069,賀柏企管科技顧問,臺北市大同區光能里民生西路１０２號２樓,121.519772,25.05741
3070,超凡同創實業,臺北市中山區興亞里南京東路２段１０８號７樓之１６,121.532194,25.051864
3071,越昇國際,臺北市中山區永安里明水路５３５號１樓,121.551735,25.078236
3072,達利餐飲,臺北市信義區敦厚里基隆路一段１０５、１０７號,121.567107,25.045155
3073,達門企業,臺北市中山區聚葉里錦州街５號２樓之１,121.523898,25.060435
3074,達飛國際企業,臺北市大安區復興南路１段２１５號１１樓,121.543947,25.039166
3075,開店一二三網路科技,臺北市松山區中正里復興北路１０１號５樓,121.544283,25.052986
3076,雅米餐坊,臺北市北投區中心里中和街１２號,121.503452,25.137685
3077,雅玨國際精品,臺北市中山區正得里長安東路１段２３號９樓,121.523775,25.049447
3078,雲端行動科技,臺北市中正區龍福里南海路２０號６樓,121.517011,25.032493
3079,順立智慧,臺北市松山區民福里民族東路６９５號,121.54866,25.063407
3080,順發電腦-台北分公司,臺北市中正區梅花里八德路１段２３號地下１樓,121.531081,25.044326
3081,黃種人咖啡餐飲店,臺北市松山區東光里南京東路五段２３巷６弄２９號１樓,121.559089,25.052194
3082,鼎天雲端服務,臺北市中正區廈安里莒光路７７號３樓,121.505372,25.031098
3083,鼎富餐飲,臺北市中山區恆安里民權東路１段６７號２樓,121.525405,25.06289
3084,鼎賀涮涮鍋店,臺北市中正區螢圃里汀州路二段１００號,121.519502,25.024876
3085,鼎賀餐飲,臺北市松山區中華里南京東路４段２１號２樓之１,121.550367,25.051907
3086,復升資訊科技,臺北市中山區撫順街４１巷１號１０樓之１,121.519433,25.063591
3087,復興奇,臺北市中山區埤頭里復興南路１段２６及２８號１樓,121.543687,25.046508
3088,葉卷,臺北市大安區臥龍里復興南路２段３５３號１樓,121.543565,25.023147
3089,傳奇網路遊戲,臺北市信義區新仁里東興路４５號６樓,121.566362,25.047726
3090,勤崴國際科技,臺北市中正區板溪里羅斯福路２段１００號３樓,121.522336,25.026841
3091,匯姿,臺北市士林區仁勇里大東路１０之６號，１０之７號,121.525347,25.087384
3092,匯豐汽車-士林保養廠,臺北市士林區永倫里延平北路６段４３４號,121.499732,25.092283
3093,匯豐汽車-內湖保養廠,臺北市內湖區麗山里內湖路１段４１１巷５６號右邊,121.5718343,25.08397853
3094,匯豐汽車-台北保養廠,臺北市中山區大佳里民族東路９７號,121.537689,25.06858
3095,匯豐汽車-北投分公司,臺北市北投區八仙里大業路２６２號,121.498555,25.12678
3096,匯豐汽車-辛亥保養廠,臺北市文山區興泰里辛亥路４段２０２巷２號,121.555584,25.00274
3097,匯豐汽車-南港保養廠,臺北市南港區西新里成功路１段３６巷２０號,121.591577,25.056848
3098,嘟嘟鳥餐坊,臺北市中山區興亞里吉林路２６巷２６號,121.529172,25.051412
3099,圓心圓國際事業-台北桂林營業所,臺北市萬華區桂林路１號１樓,121.506304,25.037675
3100,圓心圓國際事業-台北通化營業所,臺北市大安區通安里通化街７２號,121.554122,25.030174
3101,圓石禪飲-通化分店,臺北市大安區通安里通化街９０號,121.554049,25.029918
3102,夢幻遊樂園,臺北市信義區黎平里和平東路三段２１３號１樓,121.553815,25.023414
3103,媽煮湯事業,臺北市大安區光武里忠孝東路４段１０７號１２樓之４,121.54829,25.041748
3104,媽媽經,臺北市松山區復盛里光復南路６５號１２樓,121.557932,25.045594
3105,微風場站開發,臺北市中正區黎明里北平西路３號２樓，１樓及地下１樓,121.517058,25.047176
3106,微風置地-松高分公司,臺北市信義區西村里松高路１６號１之４樓及地下１之５樓,121.567277,25.038729
3107,微風廣場實業,臺北市松山區中崙里復興南路１段３９號１樓,121.544126,25.046129
3108,微風廣場實業-台大分公司,臺北市中正區東門里中山南路７號地下１樓,121.518558,25.040776
3109,想想廚房,臺北市中山區朱園里松江路６９巷１３號１樓,121.534371,25.049421
3110,意之選食品商行,臺北市文山區興隆路３段５１號１樓,121.555949,25.000376
3111,意高國際-北藝大分公司,臺北市北投區一德里學園路１號,121.46619,25.129937
3112,意連顧問,臺北市松山區富錦里三民路１６６巷３５號１樓,121.564374,25.062057
3113,愛合購,臺北市中正區光復里衡陽路５１號７樓之６,121.512184,25.042381
3114,愛普網,臺北市信義區安康里松仁路７號１４樓,121.568865,25.038265
3115,愛買客,臺北市內湖區湖元里舊宗路１段１５９號３樓,121.578652,25.06139
3116,愛點科技,臺北市信義區中興里基隆路１段４２０號４樓及４樓之１,121.559951,25.034057
3117,新世紀資通,臺北市內湖區瑞光路２１８號１至１１樓,121.576102,25.075419
3118,新加坡商三得利國際亞太餐飲-台灣分公司,臺北市中正區黎明里青島西路１１號１２樓之３,121.517767,25.044988
3119,新加坡商奔脈管理顧問-台灣分公司,臺北市信義區中興里信義路４段４５８號１１樓,121.55838,25.03283
3120,新加坡商宜睿智慧-台灣分公司,臺北市信義區安康里松仁路８９號１１樓之３,121.56875,25.037224
3121,新加坡商樂市-台灣分公司,臺北市士林區芝山里德行東路２６６巷８號２樓,121.534979,25.109412
3122,新加坡商優達斯國際-台灣分公司,臺北市信義區興雅里基隆路１段１６３號３樓之２,121.565227,25.041752
3123,新台北有線電視,臺北市信義區廣居里忠孝東路５段４１２號１２樓之２,121.575166,25.040711
3124,新光三越百貨-台北天母分公司,臺北市士林區天福里天母東路６８號地下１樓地上１樓至７樓,121.533979,25.117913
3125,新光三越百貨-台北天母分公司二館,臺北市士林區天福里忠誠路２段２００號１樓２０２號１樓２０６號地下１樓,121.534037,25.11708
3126,新光三越百貨-台北信義分公司,臺北市信義區松壽路１１號地下２樓至地上６樓,121.56728,25.036073
3127,新光三越百貨-台北信義分公司二館,臺北市信義區西村里松高路１２號,121.5668,25.038813
3128,新光三越百貨-台北信義分公司三館,臺北市信義區西村里松壽路９號,121.566662,25.036082
3129,新光三越百貨-台北信義分公司四館,臺北市信義區興雅里松高路１９號地下１樓至地下３樓﹒１樓至６樓,121.566667,25.039359
3130,新光三越百貨-台北南西分公司,臺北市中山區南京西路１２號地下１，２，３，４樓至１０樓,121.521245,25.052327
3131,新光三越百貨-台北南西分公司二館,臺北市中山區民安里南京西路１４號,121.520664,25.052433
3132,新光三越百貨-台北南西分公司三館,臺北市中山區民安里南京西路１５號Ｂ３至８樓，１７號，１９號,121.520967,25.052677
3133,新光三越百貨-台北站前分公司,臺北市中正區忠孝西路１段６６號地下１至２樓及１至１３樓,121.515302,25.046226
3134,新光影城-台北獅子林分公司,臺北市萬華區萬壽里西寧南路３６號４樓之１，４樓之２，４樓之３，５樓,121.50664,25.045591
3135,新竹物流-台北分公司,臺北市士林區忠誠里中山北路６段８８號２樓,121.524985,25.104988
3136,新竹物流-台北營業所,臺北市南港區三重里重陽路４２３巷２號,121.6089948,25.05901593
3137,新竹物流-北投營業所,臺北市北投區一德里立德路１１１號,121.471475,25.126303
3138,新東陽-士林分公司,臺北市士林區中正路３０３號,121.523719,25.094663
3139,新東陽-內湖分公司,臺北市內湖區紫星里成功路４段４９號,121.591971,25.081559
3140,新東陽-公館分公司,臺北市中正區羅斯福路４段１２６號,121.535715,25.013106
3141,新東陽-民生分公司,臺北市松山區介壽里民生東路５段９８號,121.560213,25.058441
3142,新東陽-西寧南路分公司,臺北市萬華區西寧南路７４之１號,121.505928,25.043081
3143,新東陽-忠孝東路分公司,臺北市大安區華聲里忠孝東路４段３０３號,121.555438,25.041597
3144,新東陽-武昌分公司,臺北市中正區武昌街１段２２巷１號１樓,121.512212,25.043286
3145,新東陽-林森一店分公司,臺北市中山區中山里林森北路２８２號,121.525354,25.055549
3146,新東陽-信義分公司,臺北市大安區信義路２段１８０號,121.529739,25.033553
3147,新東陽-南京東路分公司,臺北市中山區南京東路２段２０號１樓,121.528645,25.051887
3148,新東陽-師大分公司,臺北市大安區龍坡里和平東路１段２１８號,121.53205,25.026117
3149,新東陽-通化分公司,臺北市大安區通化街３１號１樓,121.554342,25.031153
3150,新東陽-國道客運京站門市部,臺北市大同區建明里市民大道１段２０９號,121.51835,25.048893
3151,新東陽-敦化北路分公司,臺北市松山區敦化北路１１２號,121.548572,25.053576
3152,新視紀媒體科技,臺北市信義區中興里基隆路２段４８號３樓,121.558467,25.031507
3153,新創行銷,臺北市中正區愛國里中華路二段７５巷１弄３５號,121.506708,25.034876
3154,新焦點麗車坊-內湖營業所,臺北市內湖區湖元里舊宗路１段８６號,121.579656,25.059319
3155,新焦點麗車坊-北投營業所,臺北市北投區福興里承德路７段９７號,121.509526,25.111801
3156,新匯流,臺北市大安區龍安里青田街４之１號１樓,121.531886,25.028338
3157,新都涮涮鍋店,臺北市中山區興亞里吉林路２４之２號１樓,121.529951,25.05114
3158,會昌實業,臺北市中山區集英里天祥路５９號９樓,121.520878,25.06328
3159,楊桃文化事業,臺北市中山區正得里南京東路１段１６號５樓之６,121.523327,25.052015
3160,楓上國際,臺北市北投區振華里榮華三路２５之１號１樓,121.52127,25.113887
3161,歆宇科技-電子商務分公司,臺北市中正區新生南路１段６號１０樓,121.532622,25.044023
3162,歆晴,臺北市內湖區湖元里民權東路６段４０號,121.581327,25.067634
3163,?豐汽車-雙園保養場,臺北市萬華區頂碩里興寧街２８號,121.5009481,25.03222577
3164,瑞佛國際,臺北市大安區錦泰里潮州街３９號,121.523377,25.029442
3165,瑞昱國際,臺北市中山區朱園里建國北路一段７８巷１８號,121.535568,25.049251
3166,瑞瑟可-玩具專賣１號店,臺北市中正區市民大道１段１００號台北地下街電子區８９號店舖,121.5131181,25.04962746
3167,瑞瑟可-玩具專賣２號店,臺北市中正區市民大道１段１００號台北地下街電子一區５５號店舖,121.5131181,25.04962746
3168,瑞瑟可-玩具專賣３號店,臺北市中正區市民大道１段１００號台北地下街電子一區４６號店舖,121.5131181,25.04962746
3169,瑞瑟可-玩具專賣５號店,臺北市中正區黎明里市民大道一段１００號台北地下街電子區９２號店舖,121.5131181,25.04962746
3170,瑞瑟可-玩具專賣店,臺北市中正區市民大道１段１００號台北地下街電子區７０Ａ號店舖,121.5131181,25.04962746
3171,禎綾科技,臺北市松山區中華里南京東路四段２５號７樓之１,121.550605,25.051902
3172,群安科技,臺北市大安區龍泉里和平東路１段１８２之２號６樓,121.52989,25.02629
3173,群英科技,臺北市中山區中央里民生東路２段１６８號８樓,121.534686,25.057716
3174,群環科技,臺北市大同區民權里重慶北路２段２４３號８樓,121.513747,25.062518
3175,義品咖啡-光復門市,臺北市大安區華聲里光復南路１８０巷６號１樓,121.557274,25.042515
3176,義美-八德一分公司,臺北市松山區復勢里八德路３段１３１號１樓,121.554546,25.04824
3177,義美-士林分公司,臺北市士林區福佳里文林路５０７號,121.524081,25.096672
3178,義美-大同門市部,臺北市大同區鄰江里重慶北路３段２５０之５號１樓,121.513573,25.07121
3179,義美-仁愛敦南一分公司,臺北市大安區敦安里敦化南路１段２５９號,121.549252,25.036776
3180,義美-內湖一分公司,臺北市內湖區港富里內湖路１段７３９號,121.578365,25.078979
3181,義美-天母門市部,臺北市士林區天母西路４２號１樓,121.525719,25.118357
3182,義美-台北吉林店分公司,臺北市中山區中庄里吉林路２５８號一樓,121.530121,25.060164
3183,義美-台北長安店分公司,臺北市中山區朱園里長安東路２段１１４之１號１樓,121.535872,25.048306
3184,義美-民權東路門市,臺北市松山區民有里民權東路３段１１２號,121.545323,25.061951
3185,義美-石牌門市,臺北市北投區福興里石牌路１段５６之１號,121.510899,25.113244
3186,義美-北安分公司,臺北市中山區永安里北安路５２６號,121.546414,25.079717
3187,義美-北投店,臺北市北投區光明路１３２之４號,121.502189,25.133695
3188,義美-光復分公司,臺北市信義區正和里光復南路４２５號１樓,121.557711,25.03605
3189,義美-松山永春分店,臺北市信義區永春里松山路２７３號１樓,121.577977,25.043384
3190,義美-金山分公司,臺北市大安區光明里金山南路２段２號,121.527059,25.033822
3191,義美-南門門市部,臺北市中正區羅斯福路１段１０２號１樓,121.520067,25.029928
3192,義美-國軍英雄館台北門市部,臺北市中正區建國里長沙街１段２０號,121.509344,25.040073
3193,義美-捷食樂大湖公園一門市部,臺北市內湖區秀湖里成功路５段１１號,121.602641,25.08334
3194,義美-捷食樂忠孝一門市,臺北市大安區義村里忠孝東路３段３０２號,121.543356,25.041464
3195,義美-捷食樂雙連門市,臺北市大同區雙連里民生西路４７號,121.520568,25.057771
3196,義美-萬華門市,臺北市萬華區富民里廣州街１３２號,121.501024,25.036561
3197,義美-復興北分公司,臺北市中山區龍洲里興安街９９號１樓,121.543567,25.056154
3198,義美-新城東一分公司,臺北市松山區安平里南京東路五段２５３號一樓,121.565138,25.051586
3199,義美-興隆分公司,臺北市文山區興泰里興隆路二段３０３號１樓,121.553349,25.001406
3200,義美-蘭雅門市部,臺北市士林區中山北路６段２６０號１樓,121.525521,25.10955
3201,義啟餐飲顧問,臺北市松山區中正里敦化北路４巷６０號,121.54462,25.050277
3202,聖兒莉國際-北站前門市,臺北市中正區黎明里懷寧街３７號２樓,121.514211,25.044826
3203,聖恩生活事業,臺北市中正區板溪里羅斯福路２段１００號２１樓,121.522336,25.026841
3204,聖特洛可,臺北市松山區敦化里市民大道４段１８３號,121.551881,25.044766
3205,蓋合工作室,臺北市大安區建倫里仁愛路４段１５１巷３５號（Ｂ區）,121.551971,25.040185
3206,蜀江宅院烤魚館,臺北市大安區正聲里光復南路２８０巷４０號,121.555711,25.039933
3207,誠品生活-士林第二分公司,臺北市士林區文林路３３８號３３８之１之２３４０號,121.525823,25.092754
3208,誠品生活-大直分公司,臺北市中山區大直里大直街７０號,121.546234,25.083587
3209,誠品生活-中正文化中心門市,臺北市中正區東門里中山南路２１之１號,121.521627,25.034679
3210,誠品生活-台大分公司,臺北市大安區大學里新生南路３段９８號１樓至２樓,121.533061,25.016987
3211,誠品生活-台大第三分公司,臺北市大安區大學里新生南路３段９８號３樓,121.533061,25.016987
3212,誠品生活-西門分公司,臺北市萬華區峨眉街５２號地下１樓及５２號１至４樓,121.505399,25.043803
3213,誠品生活-忠誠第一分公司,臺北市士林區忠誠路２段１８８號１至３樓．１８０號１至２樓，１８２至１８６號１樓,121.533427,25.116466
3214,誠品生活-忠誠第二分公司,臺北市士林區忠誠路２段１８８號地下１樓,121.533427,25.116466
3215,誠品生活-東湖第一分公司,臺北市內湖區南湖里康寧路３段７２號地下一層,121.611274,25.07021
3216,誠品生活-松山分公司,臺北市信義區新仁里菸廠路８８號、８８號２至３樓及地下２層,121.561111,25.044737
3217,誠品生活-武昌第一分公司,臺北市萬華區萬壽里武昌街２段７７號１樓至５樓及地下１樓,121.505709,25.045077
3218,誠品生活-信義第一分公司,臺北市信義區興雅里松高路１１號１至５樓及地下１樓,121.565242,25.039515
3219,誠品生活-信義第二分公司,臺北市信義區興雅里松高路１１號６樓,121.565242,25.039515
3220,誠品生活-站前分公司,臺北市中正區黎明里忠孝西路１段４７號地下一層,121.5179789,25.04630973
3221,誠品生活-捷運南港線台北站第一分公司,臺北市中正區忠孝西路１段４９號地下１樓Ｆ室,121.51767,25.047067
3222,誠品生活-捷運南港線台北站第二分公司,臺北市中正區忠孝西路１段４９號（南港線臺北車站６號販賣店）,121.51767,25.047067
3223,誠品生活-捷運南港線台北站第三分公司,臺北市中正區忠孝西路１段４９號（南港線臺北車站８號販賣店）,121.51767,25.047067
3224,誠品生活-捷運淡水線台北站第一分公司,臺北市中正區忠孝西路１段４９號地下１樓Ｃ室,121.51767,25.047067
3225,誠品生活-敦南分公司,臺北市大安區建倫里敦化南路１段２４５號地下二層,121.549273,25.039125
3226,誠品生活-敦南第一分公司,臺北市大安區建倫里敦化南路１段２４３號,121.549385,25.0395
3227,誠品生活-敦南第二分公司,臺北市大安區建倫里敦化南路１段２４５號地下１樓,121.549273,25.039125
3228,誠品生活-漢中第一分公司,臺北市萬華區西門里漢中街１１６號１至５樓,121.507242,25.043239
3229,誠品生活-漢中第二分公司,臺北市萬華區西門里成都路１３號１樓,121.50724,25.042614
3230,誠品,臺北市信義區安康里松德路１９６號地下１樓,121.574145,25.034897
3231,誠記小吃店,臺北市大安區永康街６巷６號１樓,121.529518,25.032576
3232,誠興小吃店,臺北市大安區永康街６巷１號１樓,121.529518,25.032576
3233,誠麗實業,臺北市北投區文林里致遠一路１段５５號,121.516127,25.108612
3234,資廚管理顧問,臺北市士林區忠誠里中山北路６段９０號４樓,121.524987,25.105083
3235,遠東百貨-台北分公司,臺北市中正區寶慶路３２號及延平南路１２８之１３２號,121.509114,25.041688
3236,遠傳電信,臺北市大安區敦化南路２段２０７號２８樓,121.549255,25.02601
3237,路思大創意,臺北市大同區光能里赤峰街３５之１號,121.519535,25.054457
3238,雷亞遊戲,臺北市信義區新仁里東興路４７號１樓,121.566709,25.047991
3239,福輪汽車-南港分公司,臺北市南港區西新里成功路１段３６巷２０號,121.591577,25.056848
3240,嘉柏國際企業,臺北市松山區民有里復興北路３３３號７樓,121.544421,25.059805
3241,廣紘國際,臺北市內湖區葫洲里民權東路６段２６２號３樓,121.604716,25.071592
3242,榮冠食品工廠,臺北市南港區忠孝東路６段２２５巷２弄６號１樓,121.588067,25.049608
3243,榮泰軸承,臺北市內湖區湖元里陽光街３４５巷１６號,121.577963,25.07219
3244,榮鴻企業社,臺北市南港區西新里成功路１段９４巷２弄５號,121.59217,25.057974
3245,瑪黑法式小館,臺北市大安區車層里仁愛路４段３４５巷４弄１２號１樓,121.553446,25.038858
3246,瑪榭咖啡,臺北市大安區建倫里敦化南路１段２３３巷６２號,121.552427,25.040265
3247,瘋果子,臺北市大同區光能里赤峰街４９巷３號,121.51983,25.055777
3248,瘋閱讀書坊,臺北市中正區漢口街１段８２號４樓及４樓之１,121.512182,25.0451
3249,瘦達人美味食品,臺北市信義區新仁里忠孝東路四段５５９巷１６弄１８號１樓,121.564215,25.042294
3250,睿能創意營銷-Ｇｏｇｏｒｏ全球體驗中心,臺北市信義區西村里松壽路１８號,121.567111,25.035636
3251,睿濠文創實業,臺北市信義區中興里基隆路二段５２號,121.558398,25.031395
3252,維思資訊,臺北市中正區林興里羅斯福路３段１２６號７樓之２,121.527948,25.020582
3253,網元國際資訊,臺北市中山區朱崙里復興北路２號５樓之２,121.543715,25.047768
