1119,全聯實業-中山興安分公司,臺北市中山區朱馥里興安街５５號地下,121.541887,25.056207
1120,全聯實業-中山雙連分公司,臺北市中山區集英里錦西街８號１樓,121.52171,25.060238
1121,全聯實業-中正延平分公司,臺北市中正區南門里延平南路１８９號１樓,121.507492,25.033784
1122,全聯實業-中正欣榮分公司,臺北市中正區新營里寧波東街２０號地下１樓,121.520457,25.033002
1123,全聯實業-中正南昌分公司,臺北市中正區龍福里南昌路１段５１巷１號﹒１之１號﹒３弄１號１樓,121.517397,25.031439
1124,全聯實業-內湖民權分公司,臺北市內湖區湖元里民權東路６段９０巷１８號,121.585859,25.067889
1125,全聯實業-內湖成功分公司,臺北市內湖區大湖里大湖山莊街１４８號１樓及地下一樓,121.601522,25.086138
1126,全聯實業-內湖明湖分公司,臺北市內湖區南湖里民權東路六段２９６巷１１３、１１５號地下樓,121.608962,25.06991
1127,全聯實業-內湖金龍分公司,臺北市內湖區金瑞里金龍路２１５號,121.587191,25.088151
1128,全聯實業-內湖星雲分公司,臺北市內湖區清白里星雲街１６３號,121.596442,25.08126
1129,全聯實業-內湖康樂分公司,臺北市內湖區樂康里康樂街１１６號地下１樓,121.619057,25.071071
1130,全聯實業-文山木柵分公司,臺北市文山區木柵里木柵路３段４１號１樓,121.565836,24.988575
1131,全聯實業-文山保儀分公司,臺北市文山區木柵里保儀路１２號１樓、１２號地下１樓、２６巷１之１號,121.568498,24.988536
1132,全聯實業-文山景興分公司,臺北市文山區景東里景興路１９１號地下一樓,121.54422,24.992286
1133,全聯實業-文山萬年分公司,臺北市文山區萬和里羅斯福路５段１７０巷４１號１樓,121.536254,25.004683
1134,全聯實業-六合分公司,臺北市信義區六合里松仁路２４０巷１９號１樓及２樓,121.568794,25.024451
1135,全聯實業-台北大安分公司,臺北市大安區群賢里復興南路２段２３７號地下１層,121.54371,25.025847
1136,全聯實業-台北中華分公司,臺北市萬華區中華路２段６６６之１２號地下１層,121.511419,25.024182
1137,全聯實業-台北中崙分公司,臺北市松山區吉仁里八德路３段１０６巷１號１樓,121.553731,25.047663
1138,全聯實業-台北內湖分公司,臺北市內湖區港墘里港墘路１２７巷１０號地下１層,121.576916,25.077872
1139,全聯實業-台北木新分公司,臺北市文山區樟腳里恆光街３７號,121.567051,24.982686
1140,全聯實業-台北北投分公司,臺北市北投區大同里北投路２段１１號地下１層,121.498757,25.130542
1141,全聯實業-台北吉林分公司,臺北市中山區新生里吉林路２１３號１樓,121.530407,25.060456
1142,全聯實業-台北西門町分公司,臺北市萬華區長沙街２段１１０﹒１１２號１樓,121.504004,25.040314
1143,全聯實業-台北西藏分公司,臺北市萬華區新忠里西藏路１２５巷９號１２９之５及６號１３１之４及５號,121.50236,25.028654
1144,全聯實業-台北和德分公司,臺北市萬華區忠德里西園路２段２１７號,121.494153,25.027066
1145,全聯實業-台北東門分公司,臺北市大安區光明里金山南路２段１２號地下１樓,121.526994,25.033462
1146,全聯實業-台北東湖分公司,臺北市內湖區五分里東湖路１１８號地下１層,121.615917,25.068212
1147,全聯實業-台北唭哩岸分公司,臺北市北投區東華里東華街２段１８０號地下１樓,121.511072,25.120188
1148,全聯實業-台北博愛分公司,臺北市中正區建國里凱達格蘭大道２號,121.516342,25.038952
1149,全聯實業-台北圓環分公司,臺北市大同區朝陽里南京西路１６５號１樓,121.512899,25.054078
1150,全聯實業-台北瑞安分公司,臺北市大安區新龍里建國南路２段１５１巷１６號１樓,121.53857,25.028691
1151,全聯實業-台北德安分公司,臺北市內湖區內湖里成功路４段３０巷２８弄２號,121.591844,25.082564
1152,全聯實業-台北龍山分公司,臺北市萬華區青山里廣州街２６３號,121.496519,25.036893
1153,全聯實業-台北關渡分公司,臺北市北投區一德里中央北路４段５３２號地下一樓,121.468107,25.128191
1154,全聯實業-民生西店分公司,臺北市大同區朝陽里民生西路２８０號１樓,121.513009,25.056898
1155,全聯實業-民生社區分公司,臺北市松山區精忠里民生東路４段１３３號,121.554435,25.058495
1156,全聯實業-民族西分公司,臺北市大同區鄰江里民族西路２３５號，２３７號１樓,121.512077,25.068799
1157,全聯實業-民權松花分公司,臺北市中山區合江街１３７號１之２樓,121.539332,25.061656
1158,全聯實業-永建分公司,臺北市文山區華興里木柵路１段１７７號１樓,121.550992,24.987767
1159,全聯實業-北市延平分公司,臺北市士林區葫東里延平北路５段２３８及２４０號,121.510004,25.084415
1160,全聯實業-北市和平分公司,臺北市大安區錦華里和平東路１段６３號地下,121.524539,25.027107
1161,全聯實業-北市建國分公司,臺北市大安區新龍里建國南路２段１２３巷１６號地下,121.53916,25.029466
1162,全聯實業-北市興安二分公司,臺北市松山區松基里民生東路３段１３０巷９號,121.546357,25.056418
1163,全聯實業-北投中和分公司,臺北市北投區中心里中和街４９號１樓,121.502233,25.138457
1164,全聯實業-北投明德分公司,臺北市北投區裕民里懷德街３之１０號,121.519249,25.11111
1165,全聯實業-北投致遠分公司,臺北市北投區吉利里致遠二路１１３巷１３．１５‧１５之１號,121.511351,25.116904
1166,全聯實業-延吉分公司,臺北市大安區華聲里市民大道４段１９０號１．２樓,121.554273,25.044212
1167,全聯實業-朱崙分公司,臺北市中山區朱崙里龍江路１５號１樓及２樓,121.540549,25.047417
1168,全聯實業-社子分公司,臺北市士林區社正路５９號６１及６１之１號１樓,121.510093,25.088998
1169,全聯實業-忠順分公司,臺北市文山區順興里忠順街２段２２號,121.563164,24.984669
1170,全聯實業-東湖二店分公司,臺北市內湖區葫洲里民權東路６段２９６巷２６號地下１樓,121.606666,25.072184
1171,全聯實業-松山八德分公司,臺北市松山區復勢里八德路三段２２３號及２２５號地下樓,121.556947,25.04823
1172,全聯實業-松山吉祥分公司,臺北市松山區吉祥里光復北路１１巷９９號地下,121.562403,25.050443
1173,全聯實業-松山新東分公司,臺北市松山區新東里新東街３０巷２６之１號１樓、民生東路５段２１９之１,121.56689,25.059589
1174,全聯實業-松興分公司,臺北市信義區興雅里松隆路３６號１、２樓,121.567544,25.043394
1175,全聯實業-信義林口分公司,臺北市信義區大道里林口街１７６號地下１層,121.580842,25.040634
1176,全聯實業-信義嘉興分公司,臺北市信義區中興里基隆路２段２２號地下一層,121.558715,25.031923
1177,全聯實業-南京分公司,臺北市中山區興亞里吉林路２６巷３４號１樓,121.52882,25.051383
1178,全聯實業-南港中坡分公司,臺北市南港區萬福里中坡南路７號,121.58241,25.043925
1179,全聯實業-南港中信分公司,臺北市南港區三重里經貿二路１８８號,121.614994,25.059416
1180,全聯實業-南港中研分公司,臺北市南港區中研里研究院路二段６１巷１５號地下一層,121.617248,25.044633
1181,全聯實業-華山分公司,臺北市中正區幸福里忠孝東路１段８６號,121.524434,25.044341
1182,全聯實業-華榮分公司,臺北市士林區福佳里華聲街１７號１樓,121.522215,25.096355
1183,全聯實業-凌雲分公司,臺北市南港區九如里研究院路３段６８巷９號１樓,121.614311,25.035273
1184,全聯實業-敦南分公司,臺北市大安區仁愛里忠孝東路４段１２６之１號房屋地下１層,121.547663,25.041076
1185,全聯實業-萬華民和分公司,臺北市萬華區全德里民和街１０３、１０５號１樓,121.497489,25.025335
1186,全聯實業-萬華萬大分公司,臺北市萬華區保德里萬大路４０６號１樓及地下,121.498452,25.021484
1187,全聯實業-萬華雙園分公司,臺北市萬華區頂碩里興寧街２號１樓,121.502014,25.032284
1188,全聯實業-順興分公司,臺北市文山區忠順里興隆路４段１４３號地下,121.561634,24.985169
1189,全聯實業-復興崗分公司,臺北市北投區豐年里中央北路２段１８１號１樓,121.492733,25.137805
1190,全聯實業-黎元分公司,臺北市大安區黎元里辛亥路３段２２３號１樓,121.550897,25.015967
1191,全聯實業-黎忠分公司,臺北市信義區黎忠里和平東路３段３９１巷１６號,121.558138,25.020248
1192,全聯實業-興隆二店分公司,臺北市文山區興業里興隆路２段２２０巷３１弄１１號地下１樓,121.552974,25.000346
1193,全聯實業-興隆分公司,臺北市文山區萬盛里興隆路１段５３號地下１樓,121.540933,25.004061
1194,全聯實業-鵬程分公司,臺北市松山區鵬程里健康路３９９號１樓,121.568859,25.054602
1195,吃義燉飯,臺北市松山區中正里敦化北路１２０巷１７號,121.54716,25.053864
1196,合泰藥品,臺北市中正區建國里衡陽路２０號,121.512984,25.042211
1197,合頤,臺北市大安區建安里市民大道４段１１２號,121.550586,25.044421
1198,名佳泰,臺北市中山區江寧里龍江路３０９號１樓,121.540863,25.061222
1199,向洋食品,臺北市信義區松山路１１３號,121.577951,25.047669
1200,好房國際,臺北市大安區義安里敦化南路２段７７號２１樓之１,121.549317,25.030187
1201,好時,臺北市內湖區港墘里瑞光路２８７號１樓,121.576488,25.075562
1202,好停企業-大橋停車場,臺北市大同區安西街１０５號旁邊,121.509898,25.062851
1203,好停企業-民生停車場,臺北市松山區三民里民生東路五段１６３之１號Ｂ２,121.562804,25.059149
1204,好適廚坊,臺北市內湖區麗山里內湖路一段３６７號,121.569557,25.082133
1205,好廢咖啡店,臺北市大安區龍陣里復興南路２段２１０巷９號１樓,121.542485,25.026594
1206,好樂迪-木柵分公司,臺北市文山區木柵里木柵路３段９６號地下１樓,121.56732,24.988334
1207,好樂迪-中興分公司,臺北市松山區復興南路１段２７號１至２樓,121.544115,25.046521
1208,好樂迪-內湖分公司,臺北市內湖區成功路４段６８號Ｂ１?Ｂ１之１之２８,121.592866,25.082721
1209,好樂迪-石牌分公司,臺北市北投區裕民六路１２０號地下１樓１２２１２８號,121.517628,25.114541
1210,好樂迪-西寧分公司,臺北市萬華區西寧南路６２號３至８樓,121.506155,25.043876
1211,好樂迪-通化分公司,臺北市信義區基隆路２段１０９號地下１樓,121.557259,25.028875
1212,好樂迪-景二分公司,臺北市文山區羅斯福路６段４０３號地下１樓,121.540634,24.991821
1213,好樂迪-景美分公司,臺北市文山區羅斯福路６段４０３號２樓,121.540634,24.991821
1214,好樂迪-錦州分公司,臺北市中山區錦州街１５號１樓?地下１樓及１９號之３,121.524448,25.060413
1215,好樂迪-館前分公司,臺北市中正區館前路３４號１至２樓地下１樓,121.514908,25.044666
1216,如意鍋餐飲,臺北市大安區仁慈里復興南路１段２６３號２樓、２６５號１樓、２樓,121.543855,25.035961
1217,宇翼國際,臺北市大同區星明里寧夏路１１號１２樓之５,121.515004,25.054715
1218,安心食品服務-八德分公司,臺北市松山區復勢里八德路３段１２３號１，２樓,121.554344,25.048256
1219,安心食品服務-士東分公司,臺北市士林區天祿里中山北路６段７３０號,121.528,25.115228
1220,安心食品服務-大安分公司,臺北市大安區德安里大安路１段２３７號,121.546091,25.034046
1221,安心食品服務-小巨蛋門市部,臺北市松山區美仁里南京東路４段２號,121.549954,25.051356
1222,安心食品服務-中山北路分公司,臺北市中山區康樂里中山北路２段９號及９之１號１樓,121.522836,25.05275
1223,安心食品服務-中山北路第二分公司,臺北市中山區民安里中山北路２段７６號１樓,121.522603,25.057108
1224,安心食品服務-中研院門市部,臺北市南港區中研里研究院路２段１３０號（國際學術活動中心）,121.617196,25.039985
1225,安心食品服務-中華分公司,臺北市萬華區福星里中華路１段８０號１樓、２樓,121.508812,25.045454
1226,安心食品服務-仁愛分公司,臺北市大安區仁愛里仁愛路４段３７之１１號１?２樓,121.546407,25.038194
1227,安心食品服務-內湖分公司,臺北市內湖區金龍里成功路４段２０２號,121.59545,25.084418
1228,安心食品服務-內湖文德門市部,臺北市內湖區紫陽里文德路２１２號１、２樓,121.584331,25.078307
1229,安心食品服務-內湖亞太分公司,臺北市內湖區湖元里瑞湖街８０號,121.575969,25.072568
1230,安心食品服務-內湖港墘分公司,臺北市內湖區港都里內湖路１段６３７號１，２樓,121.574779,25.080383
1231,安心食品服務-公園分公司,臺北市中正區黎明里公園路３８號１樓,121.516677,25.043847
1232,安心食品服務-天母分公司,臺北市士林區天母北路８５號１樓,121.526902,25.12238
1233,安心食品服務-天母東路分公司,臺北市士林區天山里天母東路２１號,121.531722,25.118181
1234,安心食品服務-木柵門市部,臺北市文山區木柵里木柵路３段４１之１號１、２樓,121.565922,24.988555
1235,安心食品服務-木新分公司,臺北市文山區樟樹里木新路３段１７０號,121.560789,24.981887
1236,安心食品服務-世貿分公司,臺北市信義區中興里基隆路２段２２號,121.558715,25.031923
1237,安心食品服務-台北重慶分公司,臺北市大同區保安里重慶北路３段２７１號１樓,121.514018,25.072193
1238,安心食品服務-台北華碩門市部,臺北市北投區一德里立德路１５號１樓,121.471438,25.124942
1239,安心食品服務-台北凱撒門市部,臺北市中正區黎明里忠孝西路１段３８號地下一樓,121.516407,25.04624
1240,安心食品服務-台科大門市,臺北市大安區學府里基隆路４段４３號,121.542724,25.013896
1241,安心食品服務-民生東路分公司,臺北市松山區東昌里民生東路４段１１４號１樓,121.554464,25.058071
1242,安心食品服務-民生第二分公司,臺北市松山區富泰里民生東路５段１８４號１樓、２樓,121.563745,25.058194
1243,安心食品服務-民權西路分公司,臺北市中山區集英里民權西路２５號１樓,121.521501,25.062991
1244,安心食品服務-民權東路分公司,臺北市中山區下埤里民權東路３段５號,121.541173,25.062559
1245,安心食品服務-民權林森分公司,臺北市中山區聚葉里民權東路１段７６號１，２樓，７６號２樓之１，７８號,121.52536,25.062498
1246,安心食品服務-石牌公園門市部,臺北市北投區吉利里石牌路一段３９巷１００號,121.509653,25.116336
1247,安心食品服務-石牌捷運分公司,臺北市北投區榮光里石牌路１段１７４號,121.51374,25.114502
1248,安心食品服務-北安分公司,臺北市中山區成功里北安路５８６號１樓,121.54876,25.081268
1249,安心食品服務-北投分公司,臺北市北投區長安里中央北路１段４２之１號,121.500777,25.13406
1250,安心食品服務-北投光明分公司,臺北市北投區長安里光明路２１２號,121.5039337,25.13608414
1251,安心食品服務-北投捷運門市部,臺北市北投區大同里北投路二段４５號,121.497329,25.132376
1252,安心食品服務-光復分公司,臺北市大安區光信里光復南路５５２號,121.557338,25.034588
1253,安心食品服務-吉林分公司,臺北市中山區吉林路２７號１樓,121.53017,25.050798
1254,安心食品服務-吉祥分公司,臺北市松山區吉祥里吉祥路５９號,121.562643,25.050477
1255,安心食品服務-安和分公司,臺北市大安區安和路１段７０號１樓,121.552354,25.035351
1256,安心食品服務-西華分公司,臺北市松山區民有里民生東路３段１１３巷７弄１號,121.546387,25.058568
1257,安心食品服務-吳興街分公司,臺北市信義區三張里吳興街２４３號１樓,121.563528,25.027407
1258,安心食品服務-和平東路分公司,臺北市大安區龍坡里和平東路１段２７８號,121.534167,25.025944
1259,安心食品服務-忠孝第二分公司,臺北市中正區忠孝東路２段１３２號１樓,121.531875,25.04238
1260,安心食品服務-忠誠分公司,臺北市士林區忠誠路１段１８８號１樓,121.529939,25.107907
1261,安心食品服務-明曜分公司,臺北市大安區建倫里仁愛路４段１５１巷３７號地下,121.552091,25.040574
1262,安心食品服務-東湖門市部,臺北市內湖區五分里東湖路１１０號１樓，２樓,121.615733,25.068259
1263,安心食品服務-松江分公司,臺北市中山區中吉里松江路１５６之２號１樓,121.532864,25.054655
1264,安心食品服務-長安西路分公司,臺北市大同區建功里長安西路２１９號１樓‘２樓,121.512485,25.05203
1265,安心食品服務-青年分公司,臺北市萬華區新和里青年路４２號,121.504236,25.025528
1266,安心食品服務-金山南路分公司,臺北市大安區金山南路２段１２１號１樓,121.526789,25.030287
1267,安心食品服務-林森分公司,臺北市中山區正得里林森北路１４０號１，２樓,121.525119,25.051553
1268,安心食品服務-信義通化分公司,臺北市大安區通化里信義路４段３０４號,121.554802,25.032943
1269,安心食品服務-南京光復分公司,臺北市松山區東光里南京東路５段２７之２號﹒２９號﹒２９之２號,121.558119,25.051759
1270,安心食品服務-南昌分公司,臺北市中正區龍福里南昌路１段４４號１樓,121.51675,25.031703
1271,安心食品服務-南東分公司,臺北市中山區南京東路３段１１６號,121.540267,25.05174
1272,安心食品服務-南港分公司,臺北市南港區三重里三重路１９之８號,121.613659,25.057544
1273,安心食品服務-南港昆陽分公司,臺北市南港區新光里忠孝東路６段４４４號,121.593849,25.050231
1274,安心食品服務-南港展館分公司,臺北市南港區三重里經貿二路１號,121.617345,25.056376
1275,安心食品服務-南港第二分公司,臺北市南港區三重里園區街３號２樓之９,121.611987,25.058478
1276,安心食品服務-政大指南分公司,臺北市文山區萬興里指南路２段７１號,121.574909,24.987915
1277,安心食品服務-重慶南路分公司,臺北市中正區黎明里重慶南路１段１２５號﹒１２７號１樓,121.513283,25.042112
1278,安心食品服務-格致分公司,臺北市士林區陽明里格致路５９號,121.546261,25.137932
1279,安心食品服務-莊敬門市部,臺北市信義區三張里莊敬路４６９號１﹒２樓,121.56793,25.026913
1280,安心食品服務-華碩大同門市部,臺北市北投區八仙里承德路７段４００號２樓,121.50122,25.12026
1281,安心食品服務-國家音樂廳門市,臺北市中正區東門里中山南路２１之１號,121.521627,25.034679
1282,安心食品服務-康華分公司,臺北市中山區中庄里松江路２７４號１樓,121.532948,25.059747
1283,安心食品服務-康寧分公司,臺北市內湖區成功路５段６３號１樓及６３，６５號２樓,121.606101,25.074086
1284,安心食品服務-善導寺分公司,臺北市中正區幸福里忠孝東路１段１７８號,121.526485,25.043847
1285,安心食品服務-敦北分公司,臺北市松山區民福里敦化北路１５５巷１號１樓,121.5496941,25.05420775
1286,安心食品服務-敦南分公司,臺北市大安區義安里敦化南路２段８１巷５９號,121.551096,25.030044
1287,安心食品服務-景興分公司,臺北市文山區景興路１９１號１樓,121.54422,24.992286
1288,安心食品服務-復興南路分公司,臺北市大安區龍雲里復興南路２段１５１巷４７號,121.545622,25.028453
1289,安心食品服務-新生南路分公司,臺北市大安區新生南路１段１６１之１及１６１之２號,121.532986,25.034493
1290,安心食品服務-瑞光分公司,臺北市內湖區西湖里瑞光路５１３巷３４號,121.569939,25.080149
1291,安心食品服務-福林分公司,臺北市士林區福志里福林路１８９號１樓,121.532534,25.096934
1292,安心食品服務-實踐大學分公司,臺北市中山區大直里大直街５９號１樓,121.54644,25.083388
1293,安心食品服務-劍南門市部,臺北市中山區成功里敬業三路１１號１樓,121.55591,25.083572
1294,安心食品服務-興隆分公司,臺北市文山區興得里興隆路３段４４號,121.555616,25.00029
1295,安心食品服務-雙連分公司,臺北市大同區雙連里民生西路７７號１樓,121.519782,25.057671
1296,安心食品服務-羅斯福路分公司,臺北市大安區大學里羅斯福路３段２３３號２３５號１樓,121.529781,25.019487
1297,安心食品服務-松山分公司,臺北市信義區永春里忠孝東路５段６２９號,121.579387,25.04185
1298,安心樂培,臺北市大安區正聲里仁愛路４段４０９號,121.555969,25.038005
1299,安杰瑞國際,臺北市松山區新東里民生東路五段２３７號１樓,121.567602,25.059325
1300,安欣科技服務,臺北市中山區興亞里松江路９０巷２３號１樓,121.53033,25.050615
1301,安源資訊,臺北市內湖區港墘里洲子街８１號９樓,121.570952,25.080294
1302,安誠國際企業-大同雙連第１０分公司,臺北市大同區雙連里民生西路８５號,121.519519,25.057637
1303,安誠國際企業-大安復興第九分公司,臺北市大安區?賢里復興南路２段１５９號,121.543701,25.028072
1304,安誠國際企業-松山三民第八分公司,臺北市松山區自強里三民路４１號,121.563503,25.055972
1305,安誠國際企業-信義松德第七分公司,臺北市信義區廣居里松德路３０、３２號,121.576967,25.039167
1306,忕吉小吃-台北站前店,臺北市中正區黎明里忠孝西路一段３６號,121.517043,25.046064
1307,成美洋食館,臺北市中正區幸福里青島東路７之８號,121.522619,25.044164
1308,成馬赫,臺北市大安區和安里復興南路１段３４０巷８號,121.542971,25.036013
1309,有限責任國立故宮博物院員工消費合作社,臺北市士林區至善路２段２２１號,121.5495,25.10037
1310,百八魚場餐飲,臺北市內湖區西湖里瑞光路５８３巷２２號,121.568138,25.080522
1311,百八魚場餐飲-古亭分公司,臺北市中正區頂東里南昌路２段２１６號１樓,121.524412,25.023937
1312,百八魚場餐飲-民生分公司,臺北市中山區民安里民生西路４４號,121.521331,25.057601
1313,百八魚場餐飲-石牌分公司,臺北市北投區振華里石牌路２段９０巷６號,121.51667,25.117049
1314,百八魚場餐飲-忠孝分公司,臺北市中正區幸福里忠孝東路１段１５２號１樓,121.52592,25.043981
1315,百八魚場餐飲-長安分公司,臺北市中山區朱園里長安東路２段７７號１樓,121.534364,25.048532
1316,百八魚場餐飲-南京分公司,臺北市松山區新聚里南京東路５段２０８號,121.564996,25.051187
1317,百八魚場餐飲-重慶分公司,臺北市中正區黎明里重慶南路１段１１３號,121.513323,25.042618
1318,百八魚場餐飲-基隆路分公司,臺北市信義區嘉興里基隆路２段１１７號１樓、２樓,121.557062,25.028545
1319,百八魚場餐飲-瑞光分公司,臺北市內湖區港墘里瑞光路３０５號１樓,121.575832,25.07596
1320,百八餐飲,臺北市士林區福德里文林路４２４號１樓,121.52489,25.094402
1321,百伯,臺北市大安區車層里延吉街１７８號,121.55509,25.038723
1322,百岳登山體育用品-台北分公司,臺北市內湖區湖元里新湖二路１４６巷３３號,121.578696,25.063647
1323,百岳登山體育用品-新湖分公司,臺北市內湖區湖元里新湖三路１２５號１樓、２樓,121.57839,25.064154
1324,百怡食品,臺北市士林區天山里中山北路七段５４號,121.531455,25.120597
1325,百得國際,臺北市內湖區瑞陽里文德路２２巷２２號,121.579919,25.077288
1326,百富國際-和平分公司,臺北市大安區龍淵里和平東路２段９６巷１５弄３８號、４０號１樓,121.542694,25.023251
1327,米亞甜點,臺北市大同區建泰里南京西路６４巷２６之１號,121.518347,25.051111
1328,米洛克,臺北市中山區正得里林森北路１００號１０樓之３,121.524821,25.050484
1329,米洛克創意實業,臺北市內湖區湖元里行愛路７７巷１６號６樓,121.581738,25.063035
1330,米提服飾,臺北市松山區新聚里寶清街３１號３樓之１,121.568808,25.050497
1331,自然大地生機,臺北市文山區試院里和興路１１８號,121.550221,24.985671
1332,衣時-敦北門市,臺北市松山區中正里敦化北路４巷１６號,121.547607,25.050225
1333,老爺榮康,臺北市北投區中心里中和街２號６樓,121.503706,25.137585
1334,亨嘉企業,臺北市中山區集英里撫順街３５號３樓,121.519852,25.06352
1335,伯敻-中山營業所,臺北市中山區康樂里中山北路２段３９巷３號地下一樓編號１１１,121.523743,25.054199
